{
  "version": 1,
  "width": 20,
  "height": 15,
  "tileSize": 32,
  "layers": {
    "floor": [
      [1,1,1,1,1,1,1,1,1,1,1,1,1,1,1,1,1,1,1,1],
      [1,2,2,2,2,2,2,1,1,1,1,1,0,0,0,0,0,0,0,1],
      [1,2,2,2,2,2,2,1,1,1,1,1,0,0,0,0,0,0,0,1],
      [1,2,2,2,2,2,2,1,1,1,1,1,0,0,0,0,0,0,0,1],
      [1,2,2,2,2,2,2,1,1,1,1,1,0,0,0,0,0,0,0,1],
      [1,1,1,1,1,1,1,1,2,2,2,2,2,2,2,1,3,3,3,1],
      [1,1,1,1,1,1,1,1,2,2,2,2,2,2,2,1,3,3,3,1],
      [1,1,1,1,1,1,1,1,2,2,2,2,2,2,2,1,3,3,3,1],
      [1,1,1,1,1,1,1,1,1,1,1,1,1,1,1,1,3,3,3,1],
      [1,0,0,0,0,0,0,0,0,0,0,0,0,0,0,1,3,3,3,1],
      [1,0,0,0,0,0,0,0,0,0,0,0,0,0,0,1,1,1,1,1],
      [1,0,0,0,0,0,0,0,0,0,0,0,0,0,0,1,2,2,2,1],
      [1,0,0,0,0,0,0,0,0,0,0,0,0,0,0,1,2,2,2,1],
      [1,0,0,0,0,0,0,0,0,0,0,0,0,0,0,1,2,2,2,1],
      [1,1,1,1,1,1,1,1,1,1,1,1,1,1,1,1,1,1,1,1]
    ],
    "furniture": [
      [0,0,0,0,0,0,0,0,0,0,0,0,0,0,0,0,0,0,0,0],
      [0,26,0,0,0,0,24,0,0,0,0,0,26,0,0,0,0,24,0,0],
      [0,26,0,20,22,0,24,0,21,23,0,0,26,0,0,0,0,25,0,0],
      [0,26,0,20,22,0,0,0,21,23,0,0,26,0,27,0,0,25,0,0],
      [0,26,0,20,22,0,24,0,0,0,0,0,26,0,28,0,0,24,0,0],
      [0,0,0,0,0,0,0,0,20,22,0,20,22,0,0,0,28,0,0,0],
      [0,0,24,0,0,24,0,0,20,22,0,20,22,0,0,0,27,0,0,0],
      [0,0,0,0,0,0,0,0,20,22,0,20,22,0,0,0,0,0,0,0],
      [0,0,0,26,0,0,0,0,0,0,24,0,0,0,26,0,0,0,0,0],
      [0,25,0,26,0,0,24,0,0,0,0,0,24,0,26,0,0,0,0,0],
      [0,24,0,26,0,0,0,0,20,22,0,20,22,0,26,0,0,0,0,0],
      [0,0,0,26,0,0,24,0,20,22,0,20,22,0,26,0,25,0,0,0],
      [0,0,0,26,0,0,0,0,20,22,0,20,22,0,26,0,0,0,0,0],
      [0,24,0,26,0,0,24,0,0,0,0,0,0,0,26,0,0,0,0,0],
      [0,0,0,0,0,0,0,0,0,0,0,0,0,0,0,0,0,0,0,0]
    ],
    "walls": [
      [14,10,10,10,10,10,10,10,10,10,10,10,10,10,10,10,10,10,10,15],
      [12,0,0,0,0,0,0,0,0,0,0,0,0,0,0,0,0,0,0,13],
      [12,0,0,0,0,0,0,0,0,0,0,0,0,0,0,0,0,0,0,13],
      [12,0,0,0,0,18,0,0,0,0,0,0,0,0,0,0,0,0,0,13],
      [12,0,0,0,0,0,0,0,0,0,0,0,0,0,0,0,0,0,0,13],
      [12,0,0,0,0,0,0,0,0,0,0,0,0,0,0,0,0,0,0,13],
      [12,0,0,0,0,0,0,0,0,0,0,0,0,0,0,0,0,0,0,13],
      [12,0,0,0,0,0,0,0,0,0,0,0,0,0,0,0,0,0,0,13],
      [12,0,0,0,0,0,0,0,0,0,0,0,0,0,0,0,0,0,0,13],
      [12,0,0,0,0,0,0,0,0,0,0,0,0,0,0,0,0,0,0,13],
      [12,0,0,0,0,0,0,0,0,0,0,0,0,0,0,0,0,0,0,13],
      [12,0,0,0,0,0,0,0,0,0,0,0,0,0,0,0,0,0,0,13],
      [12,0,0,0,0,0,0,0,0,0,0,0,0,0,0,0,0,0,0,13],
      [12,0,0,0,0,0,0,0,0,0,0,0,0,0,0,0,0,0,0,13],
      [16,11,11,11,11,11,11,11,11,11,11,11,11,11,11,11,11,11,11,17]
    ]
  },
  "spawnPoints": [
    { "x": 4, "y": 5 },
    { "x": 8, "y": 6 },
    { "x": 11, "y": 3 },
    { "x": 14, "y": 8 }
  ],
  "walkable": [
    [false,false,false,false,false,false,false,false,false,false,false,false,false,false,false,false,false,false,false,false],
    [false,false,false,false,false,false,false,true,true,true,true,true,false,true,true,true,true,false,true,false],
    [false,false,true,false,false,true,false,true,false,false,true,true,false,true,true,true,true,false,true,false],
    [false,false,true,false,false,false,true,true,false,false,true,true,false,true,false,true,true,false,true,false],
    [false,false,true,false,false,true,false,true,true,true,true,true,false,true,false,true,true,false,true,false],
    [false,true,true,true,true,true,true,true,false,false,true,false,false,true,true,true,false,true,true,false],
    [false,true,false,true,true,false,true,true,false,false,true,false,false,true,true,true,false,true,true,false],
    [false,true,true,true,true,true,true,true,false,false,true,false,false,true,true,true,true,true,true,false],
    [false,true,true,false,true,true,true,true,true,true,false,true,true,true,false,true,true,true,true,false],
    [false,false,true,false,true,true,false,true,true,true,true,true,false,true,false,true,true,true,true,false],
    [false,false,true,false,true,true,true,true,false,false,true,false,false,true,false,true,true,true,true,false],
    [false,true,true,false,true,true,false,true,false,false,true,false,false,true,false,true,false,true,true,false],
    [false,true,true,false,true,true,true,true,false,false,true,false,false,true,false,true,true,true,true,false],
    [false,false,true,false,true,true,false,true,true,true,true,true,true,true,false,true,true,true,true,false],
    [false,false,false,false,false,false,false,false,false,false,false,false,false,false,false,false,false,false,false,false]
  ]
}
